Option ID|Option Template|Combo Count|Question Count|Base Model %|Local Model %
1|Total sales TIMEFRAME_PARAMETER.|12|60|0.9166666666666666|
2|Total sales in DEPARTMENTGROUP_PARAMETER TIMEFRAME_PARAMETER.|120|480|0.0|
3|Total sales in DEPARTMENTGROUP2_PARAMETER TIMEFRAME_PARAMETER.|540|540|0.0|
4|Total sales in STORE_PARAMETER TIMEFRAME_PARAMETER.|1908|1908|0.0|
5|Total sales excluding EXCLUDE_DEPARTMENTGROUP_PARAMETER TIMEFRAME_PARAMETER.|120|480|0.7270833333333333|
6|The top performing store TIMEFRAME_PARAMETER.|12|72|0.6805555555555556|
7|The top performing store in SALES_GEOGRAPHY_PARAMETER TIMEFRAME_PARAMETER.|132|132|0.44696969696969696|
